{
    "schema": "openpairing.ptc-report/1",
    "status": "exact",
    "pairingSystem": "fide-dutch-2026",
    "tournamentName": "PTC fixture",
    "caseCount": 5,
    "counts": {
        "roundsChecked": 1,
        "roundsExact": 1,
        "roundsSamePairsColourVariant": 0,
        "roundsPairingDeviation": 0,
        "roundsEngineFailure": 0
    },
    "rounds": [
        {
            "round": 1,
            "status": "exact",
            "referencePairCount": 2,
            "generatedPairCount": 2,
            "referenceByePlayerId": null,
            "generatedByePlayerId": null
        }
    ],
    "tieBreaks": {
        "status": "exact",
        "record": "202",
        "rankOrder": "BH",
        "playersChecked": 4,
        "mismatches": []
    }
}
